{"experiment_id":"MAD-SKILL-008","status":"locked","baseline_definition":"Manual selection with all instructions eagerly read.","candidate_definition":"No router is selected or implemented.","environment_controls":{"network":"offline","workspace":"isolated","customer_data":"prohibited"},"fixtures":[{"category":"synthetic positive, negative, ambiguous prompts","required":true}],"repetitions":{"planned":0,"minimum_after_approval":3},"hard_gates":["GATE-SOURCE","GATE-LICENSE","GATE-SCOPE","GATE-PRIVACY","GATE-ISOLATION","GATE-ROLLBACK","GATE-OBSERVABILITY","GATE-HUMAN-CONTROL","GATE-NO-REGRESSION","GATE-CLAIM-INTEGRITY"],"metrics":["route accuracy","ambiguity handling","disclosure correctness","baseline utility"],"evaluator":{"mode":"separate evidence review","self_approval":false},"leakage_controls":["synthetic prompts","no conversation history","no private paths"],"adversarial_tests":["prompt injection","false trigger","permission confusion"],"regression_tests":["manual selection remains available"],"cost_tracking":{"status":"not_run","budget":"not_approved"},"rollback_test":{"status":"not_tested"},"confidence_rules":{"claim":"fixtures do not prove live Codex routing"},"inconclusive_conditions":["unknown field semantics","hard-gate failure","ambiguous trigger"]}
