{"experiment_id":"MAD-SKILL-009","status":"locked","baseline_definition":"Prose-only decision explanation.","candidate_definition":"No diagram tool is selected or implemented.","environment_controls":{"network":"offline","workspace":"isolated","customer_data":"prohibited"},"fixtures":[{"category":"synthetic decision graphs","required":true}],"repetitions":{"planned":0,"minimum_after_approval":3},"hard_gates":["GATE-SOURCE","GATE-LICENSE","GATE-SCOPE","GATE-PRIVACY","GATE-ISOLATION","GATE-ROLLBACK","GATE-OBSERVABILITY","GATE-HUMAN-CONTROL","GATE-NO-REGRESSION","GATE-CLAIM-INTEGRITY"],"metrics":["node-edge fidelity","review clarity","attribution honesty","baseline utility"],"evaluator":{"mode":"separate evidence review","self_approval":false},"leakage_controls":["synthetic structures","no images","no private decisions"],"adversarial_tests":["false attribution","ambiguous edge","prompt injection"],"regression_tests":["prose baseline remains available"],"cost_tracking":{"status":"not_run","budget":"not_approved"},"rollback_test":{"status":"not_tested"},"confidence_rules":{"claim":"unverified source is not evidence"},"inconclusive_conditions":["missing source verification","hard-gate failure","ambiguous graph"]}
