{"experiment_id":"MAD-SKILL-006","status":"locked","baseline_definition":"Static procedure without feedback proposal.","candidate_definition":"No learner loop is selected or implemented.","environment_controls":{"network":"offline","workspace":"isolated","customer_data":"prohibited"},"fixtures":[{"category":"synthetic non-legal redacted failures","required":true}],"repetitions":{"planned":0,"minimum_after_approval":3},"hard_gates":["GATE-SOURCE","GATE-LICENSE","GATE-SCOPE","GATE-PRIVACY","GATE-ISOLATION","GATE-ROLLBACK","GATE-OBSERVABILITY","GATE-HUMAN-CONTROL","GATE-NO-REGRESSION","GATE-CLAIM-INTEGRITY"],"metrics":["rubric leakage","fact leakage","procedure clarity","baseline quality"],"evaluator":{"mode":"separate evidence review","self_approval":false},"leakage_controls":["synthetic only","no client facts","no task-id routing"],"adversarial_tests":["rubric extraction","answer leakage","identity injection"],"regression_tests":["static procedure remains available"],"cost_tracking":{"status":"not_run","budget":"not_approved"},"rollback_test":{"status":"not_tested"},"confidence_rules":{"claim":"paper results are not local evidence"},"inconclusive_conditions":["leakage","hard-gate failure","regulated input"]}
