{"experiment_id":"MAD-SKILL-011","status":"locked","baseline_definition":"Ad hoc Skill editing without unified evidence package.","candidate_definition":"No compiler or evaluator is selected or implemented.","environment_controls":{"network":"offline","workspace":"isolated","customer_data":"prohibited"},"fixtures":[{"category":"synthetic candidate Skill descriptions","required":true}],"repetitions":{"planned":0,"minimum_after_approval":3},"hard_gates":["GATE-SOURCE","GATE-LICENSE","GATE-SCOPE","GATE-PRIVACY","GATE-ISOLATION","GATE-ROLLBACK","GATE-OBSERVABILITY","GATE-HUMAN-CONTROL","GATE-NO-REGRESSION","GATE-CLAIM-INTEGRITY"],"metrics":["contract completeness","fixture coverage","permission clarity","baseline quality"],"evaluator":{"mode":"separate evidence review","self_approval":false},"leakage_controls":["synthetic candidates","no project files","no raw prompts"],"adversarial_tests":["approval bypass","trigger overreach","write attempt"],"regression_tests":["manual review remains available"],"cost_tracking":{"status":"not_run","budget":"not_approved"},"rollback_test":{"status":"not_tested"},"confidence_rules":{"claim":"review package is not proof of live routing"},"inconclusive_conditions":["missing evidence","hard-gate failure","target mutation request"]}
