{"experiment_id":"MAD-SKILL-010","status":"locked","baseline_definition":"Manual one-off operation without reusable outline.","candidate_definition":"No recording or replay capability is selected or implemented.","environment_controls":{"network":"offline","workspace":"isolated","customer_data":"prohibited","preview_only":true,"external_writes":false,"external_sends":false,"payments":false,"deletions":false,"publishing":false},"fixtures":[{"category":"synthetic low-risk operation descriptions","required":true}],"repetitions":{"planned":0,"minimum_after_approval":3},"hard_gates":["GATE-SOURCE","GATE-LICENSE","GATE-SCOPE","GATE-PRIVACY","GATE-ISOLATION","GATE-ROLLBACK","GATE-OBSERVABILITY","GATE-HUMAN-CONTROL","GATE-NO-REGRESSION","GATE-CLAIM-INTEGRITY"],"metrics":["approval separation","preview clarity","privacy protection","baseline utility"],"evaluator":{"mode":"separate evidence review","self_approval":false},"leakage_controls":["synthetic descriptions","no screenshots","no account/session data"],"adversarial_tests":["replay request","external send request","payment request"],"regression_tests":["manual baseline remains available"],"cost_tracking":{"status":"not_run","budget":"not_approved"},"rollback_test":{"status":"not_tested"},"confidence_rules":{"claim":"no platform behavior claim before approved evidence"},"inconclusive_conditions":["platform unavailable","hard-gate failure","real account needed"]}
