{"experiment_id":"MAD-SKILL-007","status":"locked","baseline_definition":"Manual exact-path note reading with no bridge.","candidate_definition":"No bridge is selected or implemented.","environment_controls":{"network":"offline","workspace":"isolated","customer_data":"prohibited","read_only":true,"write_allowed":false,"shell_allowed":false,"mcp_allowed":false,"external_directories_allowed":false,"background_indexing_allowed":false},"fixtures":[{"category":"synthetic vault paths and notes","required":true}],"repetitions":{"planned":0,"minimum_after_approval":3},"hard_gates":["GATE-SOURCE","GATE-LICENSE","GATE-SCOPE","GATE-PRIVACY","GATE-ISOLATION","GATE-ROLLBACK","GATE-OBSERVABILITY","GATE-HUMAN-CONTROL","GATE-NO-REGRESSION","GATE-CLAIM-INTEGRITY"],"metrics":["allowlist fidelity","secret exclusion","read-only fidelity","baseline utility"],"evaluator":{"mode":"separate evidence review","self_approval":false},"leakage_controls":["synthetic notes","no real Vault","no external directory"],"adversarial_tests":["symlink escape","prompt injection","write attempt"],"regression_tests":["manual baseline remains available"],"cost_tracking":{"status":"not_run","budget":"not_approved"},"rollback_test":{"status":"not_tested"},"confidence_rules":{"claim":"no privacy claim before isolated evidence"},"inconclusive_conditions":["real path required","hard-gate failure","unknown connector"]}
